{
  "project_name": "nova-step-shoe-fashion-demo",
  "title": "NOVA STEP｜鞋服独立站",
  "description": "以都市运动与日常穿搭为灵感的鞋服概念独立站，展示鞋履、服装与系列搭配。",
  "keywords": [
    "鞋服独立站",
    "运动鞋",
    "潮流服饰",
    "都市穿搭",
    "鞋履品牌"
  ],
  "language": "zh-CN",
  "user_request": "建立一个鞋服类的本地单页独立站 MVP。NOVA STEP 是本次网站使用的虚构概念品牌，不代表真实企业。面向注重日常舒适与都市风格的消费者，突出鞋履、服装和穿搭系列。页面采用原创的产品导向编辑式构图，黑白及暖灰为主、暖橙为唯一强调色；首屏强调品牌与新品系列，中段展示最多三个鞋服类别和穿搭理念，末段提供选购意向/联系 CTA。只做展示，不实现购物车、支付、库存、登录或表单后端；不得编造价格、销量、评价、库存、真实材质、认证、联系方式、地址或品牌历史；无外部图片、字体、CDN、脚本或公开部署。"
}
